<?xml version="1.0" encoding="UTF-8"?>
<publication navigationtype="flip" orientation="portrait"
             xsi:noNamespaceSchemaLocation="Magazine.xsd"
             xmlns:xsi="http://www.w3.org/2001/XMLSchema-instance"
             xmlns:xsd="http://www.w3.org/2001/XMLSchema">
    
    <!--ERSTEN SEITEN -->
    <chapter name="chapter_00" number="00">
        
        
        <page bgcolor="#FFFFFF" number="0">
            <content>
                <modules>
                    <image allowmovement="false" allowrotation="false" allowzoom="false" doubletaptoFS="false" height="1024" pinchtoFS="false" source="publicationdata/pages/chapter_00/Erklaerungsseite.jpg"
                        width="768" x="0" y="0" />
                </modules>
            </content>
        </page>
        
        
        <page bgcolor="#FFFFFF" number="1">
            <content>
                <modules>
                    <image allowmovement="false" allowrotation="false" allowzoom="false"
                    doubletaptoFS="false" height="1024" pinchtoFS="false"
                    source="publicationdata/pages/chapter_00/Logistikumschlag_APP_1.jpg"
                    width="768" x="0" y="0"/>
                </modules>
            </content>
        </page>
        
        <page bgcolor="#FFFFFF" number="2">
            <content>
                <modules>
                    <image allowmovement="false" allowrotation="false" allowzoom="false"
                    doubletaptoFS="false" height="1024" pinchtoFS="false"
                    source="publicationdata/pages/chapter_00/Logistikumschlag_APP_2.jpg"
                    width="768" x="0" y="0"/>
                </modules>
            </content>
        </page>
        
        <page bgcolor="#FFFFFF" number="3">
            <content>
                <modules>
                    <image allowmovement="false" allowrotation="false" allowzoom="false"
                    doubletaptoFS="false" height="1024" pinchtoFS="false"
                    source="publicationdata/pages/chapter_00/Logistikumschlag_APP_3.jpg"
                    width="768" x="0" y="0"/>
                </modules>
            </content>
        </page>
        
        <page bgcolor="#FFFFFF" number="4">
            <content>
                <modules>
                    <image allowmovement="false" allowrotation="false" allowzoom="false"
                    doubletaptoFS="false" height="1024" pinchtoFS="false"
                    source="publicationdata/pages/chapter_00/Logistikumschlag_APP_4.jpg"
                    width="768" x="0" y="0"/>
                </modules>
            </content>
        </page>
    </chapter>
    <!--ERSTEN SEITEN -->
    
  <chapter name="chapter_01" number="1">
    <page bgcolor="#FFFFFF" number="5">
      <content>
        <modules>
          <image allowmovement="false" allowrotation="false" allowzoom="false"
                 doubletaptoFS="false" height="1024" pinchtoFS="false"
                 source="publicationdata/pages/chapter_01/Logistik_Page_001.jpg"
                 width="768" x="0" y="0"/>
            
            <linkage height="1024" width="768" x="0" y="0">
                <!--Chapter-->
                <link height="48" width="48" x="647" y="258" linktype="page"
                pagenumber="6" /> <!-- Zusammenfassung -->
                <link height="48" width="48" x="647" y="320" linktype="page"
                pagenumber="8" /> <!-- Chapter 1 -->
                <link height="48" width="48" x="647" y="382" linktype="page"
                pagenumber="10" /> <!-- Chapter 2 -->
                <link height="48" width="48" x="647" y="537" linktype="page"
                pagenumber="36" /> <!-- Chapter 3 -->
                <link height="48" width="48" x="647" y="693" linktype="page"
                pagenumber="44" /> <!-- Chapter 4 -->
                <link height="48" width="48" x="647" y="816" linktype="page"
                pagenumber="55" /> <!-- Chapter 5 -->
                <link height="48" width="48" x="647" y="878" linktype="page"
                pagenumber="57" /> <!-- Impressum -->
                <!--Chapter-->
                
                <!--Seiten-->
                
                <link height="25" width="85" x="516" y="255" linktype="page"
                pagenumber="6" />
                <link height="29" width="157" x="70" y="255" linktype="page"
                pagenumber="6" /><!-- 2 -->
                
                <link height="25" width="85" x="516" y="319" linktype="page"
                pagenumber="8" />
                <link height="30" width="214" x="70" y="311" linktype="page"
                pagenumber="8" /><!-- 4 -->
                
                <link height="25" width="85" x="516" y="379" linktype="page"
                pagenumber="10" />
                <link height="29" width="214" x="70" y="375" linktype="page"
                pagenumber="10" /><!-- 6 -->
                
                <link height="25" width="85" x="516" y="411" linktype="page"
                pagenumber="17" />
                <link height="23" width="307" x="70" y="413" linktype="page"
                pagenumber="17" /><!-- 13 -->
                
                <link height="25" width="85" x="516" y="442" linktype="page"
                pagenumber="26" />
                <link height="22" width="326" x="70" y="445" linktype="page"
                pagenumber="26" /><!-- 22 -->
                
                <link height="25" width="85" x="516" y="473" linktype="page"
                pagenumber="30" />
                <link height="19" width="234" x="70" y="476" linktype="page"
                pagenumber="30" /><!-- 26 -->
                
                <link height="25" width="85" x="516" y="535" linktype="page"
                pagenumber="36" />
                <link height="22" width="331" x="70" y="537" linktype="page"
                pagenumber="36" /><!-- 32 -->
                
                <link height="25" width="85" x="516" y="565" linktype="page"
                pagenumber="37" />
                <link height="25" width="382" x="70" y="566" linktype="page"
                pagenumber="37" /><!-- 33 -->
                
                <link height="25" width="85" x="516" y="598" linktype="page"
                pagenumber="41" />
                <link height="24" width="243" x="70" y="600" linktype="page"
                pagenumber="41" /><!-- 37 -->
                
                <link height="25" width="85" x="516" y="628" linktype="page"
                pagenumber="43" />
                <link height="20" width="187" x="70" y="632" linktype="page"
                pagenumber="43" /><!-- 39 -->
                
                <link height="25" width="85" x="516" y="690" linktype="page"
                pagenumber="44" />
                <link height="25" width="390" x="70" y="690" linktype="page"
                pagenumber="44" /><!-- 40 -->
                
                <link height="25" width="85" x="516" y="722" linktype="page"
                pagenumber="47" />
                <link height="26" width="366" x="70" y="721" linktype="page"
                pagenumber="47" /><!-- 43 -->
                
                <link height="25" width="85" x="516" y="752" linktype="page"
                pagenumber="52" />
                <link height="24" width="289" x="70" y="754" linktype="page"
                pagenumber="52" /><!-- 48 -->
                
                <link height="25" width="85" x="516" y="815" linktype="page"
                pagenumber="55" />
                <link height="22" width="114" x="70" y="817" linktype="page"
                pagenumber="55" /><!-- 51 -->
                
                <link height="25" width="85" x="516" y="877" linktype="page"
                pagenumber="57" />
                <link height="24" width="101" x="70" y="878" linktype="page"
                pagenumber="57" /><!-- 53 -->
            </linkage>
            <!-- Seiten -->
            
        </modules>
      </content>
    </page>

    <page bgcolor="#FFFFFF" number="6">
      <content>
        <modules>
          <image allowmovement="false" allowrotation="false" allowzoom="false"
                 doubletaptoFS="false" height="1024" pinchtoFS="false"
                 source="publicationdata/pages/chapter_01/Logistik_Page_002.jpg"
                 width="768" x="0" y="0"/>
        </modules>
      </content>
    </page>

    <page bgcolor="#FFFFFF" number="7">
      <content>
        <modules>
          <image allowmovement="false" allowrotation="false" allowzoom="false"
                 doubletaptoFS="false" height="1024" pinchtoFS="false"
                 source="publicationdata/pages/chapter_01/Logistik_Page_003.jpg"
                 width="768" x="0" y="0"/>
        </modules>
      </content>
    </page>

    <page bgcolor="#FFFFFF" number="8">
      <content>
        <modules>
          <image allowmovement="false" allowrotation="false" allowzoom="false"
                 doubletaptoFS="false" height="1024" pinchtoFS="false"
                 source="publicationdata/pages/chapter_01/Logistik_Page_004.jpg"
                 width="768" x="0" y="0"/>
            
            <slideshow allowmovement="true" allowrotation="true"
                allowzoom="true" doubletaptoFS="true" height="233"
                ispaging="true" pinchtoFS="true" width="412" x="286"
                y="739">
                <content>
                    <modules>
                        <image allowmovement="false" allowrotation="false"
                        allowzoom="false" doubletaptoFS="false" height="233"
                        pinchtoFS="false"
                        source="publicationdata/pages/chapter_01/slideshow_04/Logistik_Page_004_Abb_1_1.jpg"
                        width="412" x="0" y="0"/>
                    </modules>
                </content>
                <content>
                    <modules>